id;texto
1017522589453996032; "ouça aquecimento global 2k18 dj lucas omp de lucas omp #np na #soundcloud"
1021646583199358977; "minha boca está que eu não posso nem encostar de tão cortada e doendo que está, está feliz mudança climática de sp?"
1022067981696884736; "ahhh mas o aquecimento global é balela disse me disse fake news os cientistas são burrões e blá blá blá"
1018911594489810946; "ainda diziam ah e tal com o aquecimento global vamos ter um verão mais quente dos ultimos anos yaya"
1017527930170245121; "aquecimento global 2k18 dj lucas omp de lucas omp #np na #soundcloud"
1015934438918717440; "@nadjalopes2 @brina_gugli @jqtei por mim, o aquecimento global continua aumentando, pois comeria churrasco todos os dias. gargalhada pessoal não tem o que fazer!"
