id;texto
1014856488244908032; "#aquecimentoglobal mudará os padrões das chuvas de verão no leste da china"
1018227618414583808; "eu nem entro no mérito do o homem que diz ter criado um carro pra combater mudança climática está dando grana pra quem diz que não existe aquecimento global"
1014256892942708736; "@21carolina01 what? patinagem? não simplesmente está a chover de caralho e as pessoas estavam a deslizar na chuva. o aquecimento global está fdd mas nem tanto"
1018965341286760448; "@theradaketor @joaomiranda aquecimento global"
1015967882738651139; "o assessor da marina silva a comunista couve e alface escreveu um artigo dizendo que o churrasco de domingo é o maior vilão do aquecimento global isso é só mais uma pauta da agenda globalista 1- eu não acredito em aquecimento global 2- sou carnivoro"
1017429778599759874; "ainda aguardando o aquecimento global que os ambientalistas prometeram."
1014285349781147648; "guerrilha contra mudança climática ataca até luan santana #brandalism"
1022482458510598144; "@qrqtefds @vascoeiriz estava só a meter-me contigo. é que com o andar da carruagem, entre o aquecimento global e as bolhas da finança, isto nem sempre parece ter bom prognóstico. pode ser que as gerações que aí vêm tenham mais juízo e as coisas melhorem. ?"
1017616424053993473; "@pikokinha @beckpacs @_maykconbastos @g1 um gelo que durou 5 mil anos e ainda falam sobre aquecimento global kaka"
1020652400720470016; "@pauloribeirorio @bertolino_levi @hbredda @partidonovo30 @joaoamoedonovo algumas boas ideias liberais na economia, mas toda a agenda esquerdista comunista : ideologia de gênero, contra o escola sem partido/ endossa doutrinação, gayzismo, farsa do aquecimento global, aborto ..."
1019783475052863489; "@jgaseixas no dia em que algum @$#&amp;!# disse que há aquecimento global."
1022703722152054785; "odeio aquecimento global cadê meu friozim gostoso"
1021876966755061761; "@angelalucard666 @freeofhypocrisy e ocorreu tudo numa duzia de anos? volto a perguntar, com ou sem aquecimento global, negam que o homem está a ter um efeito nefasto no ambiente?"
1024131406249816064; "isso é o aquecimento global"
1018150985544486913; "@theoliveira98 @brina_gugli vão sim.. se dizem ambientalistas e militam contta o "aquecimento global" mas vão cortar árvores pra espalhar merda pelas livrarias"
1023986294110793734; "tire suas dúvidas sobre sustentabilidade e meio ambiente! série 'plano abc': por que o efeito estufa é tão preocupante ????? https://t.co/rjwspwe4lt"
1023961627337662466; "aquecimento global pode ser muito pior do que o previsto https://t.co/k4ysd8iqgj"
1016376436771389442; "principal fonte de emissões de gases de efeito estufa no país, desmatamento em alta preocupa cientistas"
1013411741340962816; "para quem queria saber como é fazer no viagem no tempo para o passado é isso grupos conservadores anti-ciência e progresso falando que racismo não existe, vacinação é coisa ruim, a ciência é coisa de comunista, aquecimento global ñ existe e a terra é plana"
1018186130536255488; "curso da onu meio ambiente e do instituto da onu para formação e pesquisa tem duração de 3 horas e trata do regime jurídico internacional de mudança climática, incluindo mecanismos da convenção-quadro e compromissos assumidos pelas partes https://t.co/7fera9lgyk"
1020717193099694081; ""os especialistas concordam que estes acontecimentos climáticos se encaixam nos cenários previstos pela comunidade científica como consequência do aquecimento global. mas são necessários mais estudos para ligar diretamente um episódio específico à..."
1015735955070881794; "comi lanche numero 6 deu efeito estufa na barriga"
1017241562282102784; "@isabellniky "aquecimento global", conforme a esquerda..."
1022468894383108099; "aquecimento global pode provocar milhares de suicídios"
1016743751526514691; "@gongododan_ka além de anti-higienico é causador do efeito estufa"
1015991636197822464; "@danielpozzetti @smith_hays considerando o aquecimento global como válido então, mais vontade politica do que já tem hoje ??? só se voltarmos na idade da pedra. na união europeia a politica funciona basicamente com politicas anti aquecimento global."
1019035723515809794; "hoje tive uma conversar muito profunda com o meu pai sobre aquecimento global"
1016851421285756929; "o efeito estufa é prejudicial para a vida humana, mas sem efeito estufa, a temperatura global da terra seria de 0 graus fahrenheit -18 graus celsius em vez de 59 graus f 15 graus c. #natureza"
1022026393218113536; "não vos assusta um bocado essa história do aquecimento global e do facto de daqui a nada estarmos todos a fritar? repito, os vossos netos vão pra marte."
1019531778359484416; "a farsa do aquecimento global exposta."
1014308415236136960; "disserte sobre o aquecimento global — o aquecimento global ocorre devido a falta do hexa."
1016856880881205248; "@jornalnacional aquecimento global bombando"
1019273037550641156; "resíduos orgânicos sem destinação apropriada são prejudiciais ao meio ambiente, contribuem para a emissão de gases de efeito estufa e atraem animais vetores de doenças. com essa preocupação, o..."
1021564580097662976; "mudança climática começa a afetar estações do planeta"
1015952259685859334; "eu com 3 milhões de euros por mês paro o aquecimento global com minhas próprias mãos"
1023029657736765440; "eu percebi que alguns fanboys do bolso duvidam do pouso na lua por que além do efeito dunning-kruger eles tem implicância com a nasa por que ela é "comunista": ela mostra que o aquecimento global é verificado por isso ela é "esquerdista"."
1021488462434893824; "#democraciajá #foratemer #operamundi aquecimento global pode provocar milhares de suicdios"
1022555306088390657; "e eles dizem que o aquecimento global é um mito..."
1015601326556839936; "@exame aquecimento global ñ existe! vlw, falou"
1022126683435003906; "@dngerrous mas, como o donald trump diz, o aquecimento global é algo criado na cabeça das pessoas."
1024312624224370688; "eu fico muito triste só com a merda de uma mudança climática fala sério"
1021225457809874944; "ele fala que o aquecimento global não existe, dai todo mundo que apoia começa a acreditar nisso. gente é muita alienação fora as outras baboseiras que nem ele mesmo acredita, tudo baseado nas fontes ele mesmo"
1023701386565955585; "há realmente muuuuitos pesquisadores renomados falando por aí que o aquecimento global é uma farsa. um dos principais é pesquisador do mit e publica horrores....."
1022134046351024129; "japão visa produzir apenas carros eletrificados até o ano 2050 para reduzir as emissões de gás de efeito estufa."
1013567351126667264; "será que o trump ainda continua a achar que o aquecimento global é uma invenção?"
1016120067136909314; "@nat_sgo @joanaarosas mas eu sou uma ótima companhia e sei conversas sobre os temas atuais, aquecimento global, globalização mundial, o aumento do pib e essas coisas :(("
1021911375931748353; "@m_junio aquecimento global"
1022421777580994560; "desaceleração de correntes oceânicas pode intensificar aquecimento global"
1020390081557823488; "opostos o absolutismo acabou e veio a relatividade. a guerra fria deu lugar ao aquecimento global. era óbvio que o globo seria substituído por uma terra plana. lt;todo dia um miniconto de fc de até 30 palavras.gt; lt;gostou odiou sugestões pedidos comente! compartilhe!gt;"
1019953702629605376; "cientista ‘pai do aquecimento global’ finalmente admite que a teoria está errada https://t.co/gju3j2bdeu"
1017508322231111680; "cadê o aquecimento global? aqui em poços está frio demais! kkkkkk! vou congelar! kkkkkkkk!"
1014317220640559104; "tem um curso muito legal sobre mudanças climáticas e aquecimento global no future learn disponivel ate 12 de agosto gratisss vao estuda"
1021434431582687233; "@theumilk99 @lauramartiins22 *alterações climáticas. aquecimento global é uma das alterações"
1022524766622818312; "na europa aonde era pra ser frio ,tão morrendo de calor ,isso não é nada ,cada ano que passa vai se cada vez pior ,não param com esse efeito estufa #jornalhoje"
1016663218155081728; "se o aquecimento global existe porque hoje ta frio? ?? refutados"
1015731819050921984; "vai aquecimento global tamo junto"
1017130664901201921; "só gambino pra fazer uma música que fala sobre aquecimento global na vibe "música de boa de verão vamos curtir feels like summer uhul girl"."
1017733336352149504; ""não existe aquecimento global""
1015649072588492800; "@exame está bom que vou deixar de fazer meu churrasquinho de domingo por conta do aquecimento global! que se foda, são 40 anos falando em aquecimento global e até agora não vi nenhuma verdade nessa ladainha."
1017562180215103490; "se você tivesse que façer uma precentação de 20 minutos sobre qualquer assunto, qual sería e por que — aquecimento global ou os efeitos da alimentação no corpo por motivos óbvios... bué clichê mas são..."
1024437371188719616; "@thiago_p efeito do aquecimento global kkk... vcs tem que voar! #byglorinha"
1021544951803535361; "@mafia5441 @claracamargol @guajajarasonia garanto a você. nenhum cientista sério contesta que o aquecimento global é antrópico. rigorosamente todas as evidências apontam nesse sentido. procura "o que você faria se soubesse o que eu sei" (blog, youtube e facebook)."
1022885658698940416; "uma experiência antropológica é abrir os comentários de qualquer matéria sobre aquecimento global e ver a quantidade de gente acha que é fake news"
1022211429443809280; "@pombococo @plotin0 @vinicius_rjo @smith_hays @ricardomarilena @mpf_go @mblivre vamos ao bingo do ~gay de direita~ quem marcar tudo primeiro grita mito ? ?olavete ?bolsonarista ?trumpista ?família tradicional ?contra aquecimento global ?contra cultura árabe nas escolas ?"máfia esquerdista global""
1018548331310698496; "gostei de um vídeo @youtube da usp revela a farsa do aquecimento global no programa do jô!"
1024440437984124929; "aquecimento global não existe"
1016058762602393600; "@safbf saquei. tipo algumas pesquisas sobre o “não” aquecimento global."
1023454199722508289; "@eikebatista essa onda de calor unicamente ao aquecimento global.desde o início dessa onda de calor, que vem afetando todo o hemisfério norte há várias semanas, os cientistas apontam que ela é compatível com as tendências anunciadas pelos modelos climáticos."
1017869654721777665; "@juliotrouxa se o mar chegasse lá não existirá muitas outras cidades pois lá e super alto! mas não desista dos seus sonhos! o aquecimento global está aí!"
1021821516525318144; "poluição, indústria animal, incêndios, etc = global warming granizo num país onde era suposto ser verão é só uma das um imensas consequências do aquecimento global"
1020659305987674114; "@abmcgrazi @mjcosta_ @albino_wagner grazi, entendo o que você quer dizer, mas acho que você foi imprecisa. nada do que aprendi sobre a realidade do islã, do comunismo, do aquecimento global etc. veio da escola ou dos jornais. infelizmente, não é nesses meios que encontramos a verdade. ?"
1018560220048646144; "professor da usp revela a farsa do aquecimento global."
1022829442266292225; "@th3_bdr na verdade vamos é morrer de velhice, quando o dano do aquecimento global for suficientemente significativo nenhum de nós vai estar cá para sentir /shrug"
1016395094088409090; "já estou a ficar preocupado com isso do aquecimento global. como temperatura sobe as 17h?!?"
1020422850531024896; "eventos extremos indicam que aquecimento global é uma condição plausível e governos devem se preparar para seus efeitos."
1021490022590148613; "aquecimento global pode provocar milhares de suicídios https://t.co/jbfe7yhbmc"
1013502413842591744; "cheguei no sul da frança. avisa pro alexandre garcia que tem aquecimento global por aqui."
1014531699689041925; "temperatura no verão: baixa pessoas espertas: aquecimento global ignorantes: ai lmao se fosse aquecimento global estaria quente"
1024118314979782658; "só esperando algum jornalista no #rodaviva falar que o aquecimento global é culpa do bolsonaro."
1021593368080670721; "@eldermachadole2 @leandroruschel um judeu ortodoxo revoltado com o aquecimento global no verão do canadá"
1021923047350124549; "circulação oceânica diminuiu drasticamente e o aquecimento global não é o culpado"
1021794486920404993; "desenvolvi uma teoria sobre o aquecimento global que é mesmo mindblowing, só não a coloco aqui porque não me apetece escrever"
1024197008012308480; "eu tenho certeza que essa chuva de granizo tem a haver com o aquecimento global, a última chuva de granizo que deu aqui foi bem fraquinha e não igual essa que parecia as chuvas que dá no sul ."
1019574664329334784; "#contrafakenews - aquecimento global pode diminuir a taxa de natalidade.: via @youtube"
1016025922510696449; "voltemos pro churras...que continue o aquecimento global."
1014328343464988672; "@omeleft mudança climática? putz, isso é doença?"
1019532684706697217; "@o_antagonista a farsa do aquecimento global"
1021415361110003717; "@carneiro55_kb @theumilk99 é curioso verificar que há aumento de temperatura no polo norte e arrefecimento na mesma proporção do polo sul... ainda não há registos suficientes para atestar o aquecimento global. as perfurações feitas nos polos, mostram que o planeta foi mais quente e mais frio..."
1019663875736825857; "falta de refrigeração afeta bilhões em meio a aquecimento global https://t.co/clziawvo5a"
1020937803151159296; "sabris sensata até já trouxe o aquecimento global e efeito estufa pra roda"
1016694237365178369; "@cbnoficial aquecimento global pegando fogo."
1016001665776963584; "@pedroruizilva @guilhermeboulos desde nunca. já foi num velório e perguntou: do que ele morreu? comprou maçã normal, porque a "orgânica" era muito caro. ? é ridículo como a esquerda cria falácias como esta e como a do aquecimento global. ?????"
1022259348599439360; "@marcxsilva yes, a cena é que mais de metade dos factos que ela citou nada tem a ver com o aquecimento global ?"
1015692721892315136; "não pode esquentar 2 grau que enche de mosquito a porra toda... imagina esses arrombado falando que 2 grau de aquecimento global é poca bosta, espero que eles todos morram com mosquito atolado no cu"
1021162426778054656; "fala correspondente gleice. aqui, nada de alteração climática por enquanto. manaus segue sem chuva. vou ficar atenta nos meus mamilos para mais informações."
1015282663073222656; "@exame vilão do aquecimento global não é o boi nem o churrasco e sim aquela espécie degradante com bilhões de seres espalhados pelo planeta liberando gases, além de outras atitudes de desrespeito às demais espécies e o próprio planeta. creio que estarão fadados a extinção se não mudarem"
1017385209480794112; "@limpusdickus uma burra. já lhe bloqueei não sei o nome agora, mas é a que estava a discutir comigo o aquecimento global"
1013592113093767168; "boa noite [1/7 22:13] augusto: não sei nem oq é aquecimento global [1/7 22:13] augusto: é tipo quando ta quente no estúdio da globo ?"
1021135102670180353; "eu sinto saudades de trampar de uber, no mesmo dia eu carreguei um doutor em odonto, um traficante, um professor e uma enfermeira. no mesmo dia conversava sobre aquecimento global, cinema, futebol, politica, rap, comida, viagem. cada viagem era um universo de informações."
1018534260918161409; "gostei de um vídeo @youtube os gases de efeito estufa realmente funcionam | minuto da terra"
1019651170992885761; "@lef0nque adultos que passaram quinze ou vinte anos congelados na casa dos pais e que o aquecimento global libertou de seu cárcere gelado"
1017558742789967873; "@momentsbrasil @marialcab claramente culpa do aquecimento global"
1016809597217230854; "e vem os cara fala de efeito estufa... ahan"
1014640475310092293; "@vivias_ outro dia uma guria me falou que aquecimento global é uma teoria."
1023023434689855489; "@sharkovisky olha o aquecimento global ai crlh"
1018199448139288583; "o childish gambino é muito genio feels like summer é toda gostosinha e dai bum é sobre aquecimento global"
1016716089676500992; "eu: kkkk esse inverno não está com nada nem eu senti frio e olha que sou friorenta pacas aquecimento global etc inverno: a eu:"
1018228564167184384; "ontem eu contei minha vida toda pro pedro, falei até de aquecimento global"
1016421707219918848; "#proenemaovivo prof como funcionou o, um movimento nacional para a promoção da luta contra o aquecimento global no japão ?"
1023738487575650304; "alô vc, paulistano desse brasil. se você esperava um inverno descente, esqueça! já era! it's over! agora só resta abraçar o aquecimento global msm. um brinde a destruição do meio ambiente! avante "desenvolvimento"! ;)"
1017231526621302789; "assim o boneco de olinda fica c/aquecimento global."
1024460523524505600; "estamos em agosto. no outro dia granizou em paris. mas o aquecimento global é uma invenção dos chineses. :)"
1019190198549303296; "com aquecimento global, falta de geladeira e ar condicionado vai afetar mais de 1 bilhão de pessoas temperatura elevada vai elevar dificuldades de preservação de alimentos e de medicamentos naqueles que não possuem aparelhos de refrigeração, diz levantamento da ong "sustain…"
1024424094660476931; "a #supremacorte dos #eua rejeita tentativa de @realdonaldtrump de paralisar ação que acusa o governo dos eua de ignorar os perigos das #mudançasclimáticas. https://t.co/0ngpbibz1c"
1016105024919867392; "@luizaabulsing escreve em cada página assim: aquecimento global é o aquecimento do globo que é a terra pronto 10 páginas oqjdjsjdjs"
1014506784457969665; "grupo de pesquisadores determinou motivo da extinção de seres do período ediacarano, que ocorreu há cerca de 500 milhões de ano"
1021726208088858625; "e o tal do aquecimento global não era pra esquentar o mundo inteiro???? então porque faz frio em rondônia???????"
1016682569352536065; "@pcfilho aq. global e efeito estufa são bastante corroborados cientificamente, o que não é é se a causa é antrópica, ou se co2 é tão importante quanto reverberado pela mídia."
1021911559575142402; "@sputnik_brasil em 3 bilhões de anos, com o sol três vezes maior do que hoje, os oceanos terão entrado em fervura. o efeito estufa fará a temperatura chegar a centenas de graus celsius. sem água líquida, a vida acabará de vez. nem vamos sentir o impacto"
1023720026807984128; "@evandro_fi foda esse aquecimento global"
1019749300757200896; "o primeiro animal extinto devido ao aquecimento global foi o sapo dourado em 1989. #animais"
1019605078234288128; "@gui_branko culpa do aquecimento global"
1013959856263442435; "@jhxnsxns @mai_alvs @filhodevaldir tudo culpa do aquecimento global"
1020304207562276865; "aquecimento global devasta árvores milenares do líbano"
1021742496479633408; "@natalierosa aquecimento global."
1020812913521635330; "@vitorflxx @effysciggy se o aquecimento global não é real porque club penguin acabou?"
1021479961750892544; "@theumilk99 p a próxima tens que pôr uma resposta ao teu tweet você uma explicação do porque de ser aquecimento global"
1016660453227925505; "desmatamento em alta pode minar chance de o brasil cumprir meta contra aquecimento global @estadao:"
1023536200152440832; "@luciaguimaraes não fui claro. uso do solo (destruição de florestas) é o grande motor de mudança climática no brasil. ruralistas, hoje extremamente poderosos no congresso, não querem nem ouvir falar no assunto."
1015063925568819200; "pergunta sobre aquecimento global na prova, aí eu e ketlen "por conta do aquecimento global as pessoas vão morrer queimadas" kkkkkkkkkkkkkkkkkkkkkkkkkkkkkkkkkkkkkkkkkkkkkkk, crlh mané"
1014486548992098311; "qual seu pensamento para o aquecimento global — mano eu mal sei da minha vida vou saber do aquecimento global"
1021188597897187329; "@f_montibello @guajajarasonia @midianinja quando um país como o brasil, que está cada vez mais industrializado ameaça sair desse acordo só prova cada vez mais que os ideais capitalistas estão sobrepondo a necessidade de conservação da natureza. o aumento dos gases de efeito estufa faz com que a temperatura do planeta"
1017156440191062016; "uma #hottake tão quente que adiantou em 100 anos o aquecimento global"
1016521112656793600; "@rafacasari aquecimento global é quando a globo fica quente né não ??"
1019567056960684033; "professor da usp revela a farsa do aquecimento global no programa do jô!..."
1022864340003815424; "eu quero muito ser o armandinho quando eu crescer mas graças ao aquecimento global e o fim do mundo causado pelos humano, não vou poder... muito obrigado seres humanos"
1022879058881859585; "?? a culpa também é dos laguinhos: sua fonte no jardim pode virar um problema na contabilidade do aquecimento global https://t.co/sau5kyymxm"
1016723072332771328; "eu não tô feliz com essa mudança climática quero calor de volta a g o r a"
1018120679214833665; "conferência no instituto de energia e ambiente da usp discute o papel dos biocombustíveis no combate ao aquecimento global. confira: #ambiente #ecologia #energia #bionenergia"
1023571825970872320; "o cara falando sobre industrialização e inovação, aí o cara vem "mas e o aquecimento global que vem com a indústria?". pelo amor de deus, até os cientistas do brasil em sua maioria são uns bostas."
1022497332192059392; "politizaram tudo, desde a construção de barragens até à "luta contra o aquecimento global" nunca pensaram é que os ciclos mudando, iam ser atingidos em cheio e o pior pode estar para vir, já em 2019"
1022261263794163716; "eu juro que não entendo como é que os políticos não tomam medidas mais drásticas sobre o aquecimento global"
1020689106328748034; "@portalr7 até as eleições , ira chegar um momento que bolsonaro tera que se cuidar até em soltar um pum em publico, pois ira correr o risco de um jornaleco escutar , e fazer uma longa matéria , tipo: bolsonaro solta pum em publico e ajuda a acelerar o efeito estufa e destruição do planeta."
1022603417087299584; "adicionei um vídeo a uma playlist @youtube será o planeta terra após os impactos do aquecimento global"
1019289577520066561; "estamos entrando em uma mini era glacial, informação escondida porque o suposto "aquecimento" global é uma farsa. surgiu para obrigar a troca da tecnologia de refrigeração cujo prazo das…"
1022159922388189184; "aquecimento global intensifies ????"
1023045685996863489; "só queria alguém pra entrar em uma discussão sobre o efeito estufa comigo"
1015710331216285697; "@jqtei que aquecimento global antártida regista a temperatura negativa recorde!"
1021862370145173504; "não me tentem enganar eu sei bem que o aquecimento global não existe nos è que nos tamos a aproximar do sol"
1018991647600848896; "aquecimento global"
1017441782928478208; "inclusive, em 2016, a agência @greylondon sugeriu substituir o panda pelo urso polar pra refletir o efeito negativo do aquecimento global na espécie"
1020131949636202496; "aos interesses de quem esses ditos atende...."
1015998702962597888; "gostei de um vídeo @youtube ção de co2 em sedimentos pode ser viável contra aquecimento global - space"
1023707272323715072; "cadáveres desaparecidos durante décadas sob geleiras suíças emergem com aquecimento global"
1021988971159674886; "@coewilli willi! devido a nossa transmissão ser via satélite, a mudança climática de temporais, chuvas e nuvens podem realmente causar intermitência e ausência de sinal por alguns instantes, nestes casos, pedimos que desligue o receptor da tomada, aguarde (...)"
1017920518475993088; "bactérias e vírus de milhões de anos atrás estão descongelando por causa do aquecimento global e não temos imunidade para esses micro-organismos , o que os seres humanos estão fazendo com o planeta ??"
1021175619424608258; "o programa brasileiro ghg protocol, que busca estimular a cultura corporativa para a elaboração e publicação de inventários de emissões de gases do efeito estufa, chegou ao seu 10º. inscreva-se no evento que comemora essa marca!"
1022316427062247429; "desaceleração de correntes oceânicas pode intensificar aquecimento global"
1021583214140444675; "@drklewi rodan e mothra acordando devido a destruição ambiental e mudança climática antrópica."
1022493944368824321; "mini-thread sobre o #greeceonfire e a tragédia climática na europa. aquecimento global não é brincadeira."
1015812775556321281; "@exame os caras não cansam gargalhada a próxima vai ser dizer... as fake news culpada número 1 do aquecimento global."
1017815929210712065; "sema discute inventário de emissões de gases de efeito estufa de aracaju leia mais: https://t.co/qxo5soamoa"
1023988063150718976; "@estadaointer "aquecimento global não existe" e "a terra é plana""
1021965881381974018; "um dia eu vou beber tanto até falar que o problema do aquecimento global é que muita a gente acredita em deus, que nem o cellbit"
1021335567173324800; "@gugachacra e o idiota do trump acha que não tem aquecimento global ! triste pelos cedros ..."
1014296874302484480; "aquecimento global"
1023895245027790848; "não era isto que os cientistas diziam que ia começar a acontecer com o aquecimento global"
1017370308569911301; "aquecimento global é uma invenção do governo pra não contar pra gente que a terra ta indo na direção do sol"
1017076329022480386; "@mvinni @anacronices o probl é que a imprensa ecoa. no interesse de imbecilizar e não de debate, mesmo porque não existe debate possível para idiotices. aquecimento global, terra plana, vacina, homem na lua, "esoterismo quântico", criacionismo... a lista é interminável."
