id;texto
1014700745176895490; "o general queria vender a teoria do roubo de nuvens, mas o responsável pela meteorologia já estava comprometido com a teoria do aquecimento global ? resultado: não se entenderam."
1017219863415312384; "@julien_vives @joaquimteixeia biólogo? formado no brasil? isso responde tudo, não preciso comentar mais nada. diversos cientistas já declararam que o aquecimento global é uma farsa. mas no brasil, por algum mistério parece que as publicações deles não são lidas!"
1022522901357047814; ""cadáveres desaparecidos durante décadas sob geleiras suíças emergem com aquecimento global""
1021569107811028992; "@claracamargol @mafia5441 @guajajarasonia essa senhora é claramente aquelas tias que compartilham notícias de "zap" do tipo (não existe aquecimento global, a globo que inventou isso, repasse para seus amigos)."
1017831766084726785; "aproximadamente 20% das emissões de gases do efeito estufa são causadas pelo desmatamento, revela relatório da fao"
1017904015970131969; "o feels like summer do childish gambino é um political statement acerca do aquecimento global disfarçado por uma chill vibe"
1016672172658524160; "novo estudo sugere que o aquecimento global pode ser o dobro do que os modelos climáticos preveem"
1018652723896602624; "@onubrasil @nacoesunidas @uncclearn um vulcão em atividade expele mais co2 que todo planeta kkkkkk cada região tem seu microclima kkk, aquecimento global é piada e pra arrancar dinheiro com impostos e frear o crescimento de países como os eua , por isso trump saiu kkkk"
1022693578286477317; "estudo mostra que a velocidade das correntes varia naturalmente ao longo do tempo. por anos, o ritmo rápido ajudou a conter o aquecimento do planeta, mas esse tempo acabou. …"
1021448545612820480; "vamos nem falar que a agropecuária também é a maior responsável pela emissão de gases que intensificam o efeito estufa, maior que todos os transportes juntos mas não, vamo lá, come carne todo dia o importante é andar de ônibus ao invés de carro"
1022890789272207360; "@jornaloglobo sem duvida, é aquecimento global. o que nao se tem certeza é sobre o que o está causando. ha varias teorias. poluiçao?! pode ser.. mas em 1961 foi o verao mais quente registrado na europa... naquela epoca nao havia tanta poluiçao quanto agora.."
1017146592103747585; "esse cara pode acabar com o aquecimento global cadê a nasa cadê os governo tudo"
1014217905364439040; "os resultados são significativos – redução de mais de 3,4 toneladas de 2010 a 2017 -, o equivalente a emissões de gases de efeito estufa de mais de 728.000..."
1015569939019784192; "são 9:15 e o nicolas está falando em efeito estufa"
1021853041065185280; "aquecimento global não existe ?"
1020445399356669952; "acordei hoje com a temperatura em 20 gráus, agora, está 12. e tem uns acéfalo por aí que abre a boca pra dizer que o aquecimento global não existe"
1024368995582005248; "@lra_amorim @astro_pontes @guiximenes @benebarbosa_mvb você sabe o que é consenso científico? é quando existe uma quantidade significativa de estudos e revisões sistemáticas que endossam um ponto em comum de maneira quase inquestionável, como as consequências negativas do aquecimento global e a eficácia das vacinas."
1019748090557943810; "teorias para o fim do mundo: aquecimento global. vai morrer todo mundo queimado ou afogado..."
1020095706969837568; "@yzaash ele já está morto amiga aquecimento global matou"
1021831638668529664; "@canaldootario alguém negar o aquecimento global é o cúmulo da ignorância"
1022647437528391681; "@slaymourayoxx @imargss @fabianaascavaco @wtv_tbh_ com esse aquecimento global tu queres mm sair de casa? loka"
1021158522401230849; "@guajajarasonia o que é o efeito estufa?"
1019941971211816960; "@pirulla25 é esse ano não teve inverno .... isso porque o aquecimento global é uma farsa illuminati! kkkkkkkkkkkkkkkkkkkkkkk"
1019835606204080129; "@massanorii aquecimento global só lembro mesmo por causa de gamba"
1021579685115953153; "feels like summer do childish super gostosa de se ouvir, mó sensação boa. aí fui ver a letra, ele fala de aquecimento global wtfff childish"
1017765454012715010; "#climateresistance a cause the entire world should support."
1015771041958973440; "vilão do aquecimento global é a fabricação do papel que imprime essa b...ta"
1013808814917709825; "@vvvlovato vai ver é o aquecimento global que esta deixando ela assim"
1022205366061424642; "@metsul @agrocasting aquecimento global...#sqn"
1018658396902514690; "@gabrlelplnhelro será que é culpa do aquecimento global? ah já sei, deve ter sido a eleição do trump. a invasão predatória da europa não tem nada com isso."
1015971358516408320; "@atalaiabrazuca foda-se o aquecimento global. quero meu churrasco."
1017799556262703106; "to rindo muito desse tweet da britney kkkkk o que aquecimento global e lady gaga tem a ver???"
1024078522212593665; "suprema corte dos eua rejeita tentativa de donald trump de paralisar ação sobre mudança climática"
1015625346568409089; "tomara que tenha muito aquecimento global aí não precisa nem de fogo pro churrasco"
1015591801200226305; "é vilão do aquecimento global porque causa resfriamento local, por isso o sul é muito mais frio"
1019203578253078528; "com aquecimento global, falta de geladeira e ar condicionado vai afetar mais de 1 bilhão de pessoas https://t.co/g6eizuyhwr"
1015901719656587264; "então quer dizer que o churrasco de domingo é o vilão do aquecimento global meus deus, hein!"
1020079904749178881; "quando que vai acontecer uma inversão térmica e londrina vai ser fria???? vai logo aquecimento global"
1023571194044395523; "#conhecereleições2018 perguntas sobre investimento real em ciência básica e como combater o negacionismo científico, visto a presença de pseudociências no sus e como combater o aquecimento global"
1014877331872210944; ""ah mas o aquecimento global é um mito" mimimi"
1013984162217431040; "quer tomar bomba? pode aplicar. mas eu não garanto se vai inchar. efeito estufa: ação e reação. estria no corpo, ae, vai vacilão"
1022927274964910080; "“o aquecimento global é, além do mais, uma fraude perpetrada por cientistas com interesses dissimulados, mas que têm necessidade urgente de fazerem cursos de geologia, lógica e filosofia da ciência.”"
1018884907941154816; "acabou a nuttelage de #fifaworldcup começa agora um campeonato de verdade. flamenguista achando que aquecimento global é culpa do são paulo. campeonato que vale gol de mão, juíz que anula gol pra um time só. time sem mundial. interferencia externa, enfim. campeonato raiz."
1017239620009021440; "quando eu tava no 4° ano me prometeram que em 2020 não ia mais ter água por culpa do aquecimento global. kk"
1020029552247140352; "@tahtudodominado o aquecimento global é tremenda farsa mas não conhecia essa da camada de ozonio não."
1015643636086853633; "@exame aquecimento global é o meu ovo!"
1024435876582117378; "aquecimento global, meus amigos! kkkk bem atual #otemponãopara"
1022172033709498373; "como diz a amiguinha da minha prima o aquecimento global é oq libertou os escravos (????) kkkkkkkkkkkkkkl"
1023977913513926656; "kkkkk agora o aquecimento global foi longe demais"
1015210410134462465; "obama critica falta de interesse de trump na ciência e na mudança climática"
1014555499155640320; "stop aquecimento global"
1020075032393977856; "@miguelao77 estás te a rir mas é verdade... isto é o aquecimento global,as temperaturas estao a mudar internacionalmente.o ártico está a sofrer o degelo e nós cm as temperaturas a diminuirem.é cada vez mais frequente chuva cm calor por exemplo,porque o clima portugues está também a mudar mas ya"
1016399882007920640; "um artigo com os resultados do estudo foi publicado na revista científica nature geoscience"
1015399685257822209; "gostei de um vídeo @youtube ção de co2 em sedimentos pode ser viável contra aquecimento global - space"
1018095643208880128; "aquecimento global pode ser muito pior do que o previsto"
1017365232749088769; "o aquecimento global não é real mas tamos a meio de julho com 18°c e sol nem o vejo"
1021501910296289281; "aquecimento global revelando corpos de alpinistas que morreram na suíça"
1016144359715033088; "cidades têm papel decisivo na redução de emissões de gases que causam aquecimento global"
1013912316751040514; "esta merda do aquecimento global e da alteração do comportamento dos animais deixa-me triste porque ditados como "abril águas mil" e "gaivotas em terra tempestade no mar" deixam de fazer sentido e desaparecem. dito isto, quantos ditados é que já desapareceram por causa disto?"
1013575166960562178; "a moça não falou na tv, mas eu sei que estamos passando por uma alta pressão atmosférica. e do jeito que a coisa anda nebulosa, a previsão é de nuvens carregadas com fortes pancadas. pessoas frias em pleno aquecimento global. chuva molhando gente completamente seca"
1019756377986781185; "a vontade de morrer está igual o aquecimento global, só aumentando"
1023414108073467904; "voltando pra casa, passando pelo jacaré, sentou duas gordinhas muito gatas com mó cara de safadas atrás de mim. fiquei tão ereto que meu p** chegou a rasgar a atmosfera do planeta. acho que agora sim teremos o aquecimento global gargalhada ???????"
1021485062729224193; "@carneiro55_kb @zeno_1972 @theumilk99 não estava taggado, mas continuo a achar que se era ironia, não se deveria referir a «desde que conhecemos o planeta terra» e sim: desde sempre, afinal a maior alteração climática terá ocorrido quando o planeta começou a arrefecer após colisão de asteróides e a lava arrefeceu ;)"
1014880106366554114; "no #tbt, a reportagem do #jenatv de 10 de julho de 2017, que colocou em debate o uso de ônibus elétricos para reduzir os gases de efeito estufa no meio ambiente. afirmado pelo acordo de paris, o brasil deve, até 2025, reduzir a emissão em 37%. confira:"
1013879807011180545; "@pamelaraber olá, pamela! tudo bem? devido a nossa transmissão ser via satélite, a mudança climática de temporais, chuvas e nuvens podem realmente causar intermitência e ausência de sinal por alguns instantes. precisando, me acione por aqui! ?"
1015586976534278155; "https://t.co/e9fi8gahfa ? a mudança #climática está liberando #vírus mortais de volta à #natureza.  "
1023319864109424641; "mais provável os chatos acabar com o mundo do que o aquecimento global"
1021030865730777093; "?? as emissões de carbono estão crescendo ? o mundo está enfrentando uma crise hídrica ? a fome está em ascensão o mundo precisa tomar medidas urgentes para combater a mudança climática e seus impactos! #ods13 - https://t.co/oyuiczcjaj"
1019427983608700928; "o aquecimento global é underrated"
1019618158141984770; "@rogerioandres @nicocesaro @ig vcs veem comunismo e socialismo em tudo que é canto , chegam a falar que quem acredita em evolução ou no aquecimento global é comunista , se cuidem . parem de absorver conteúdo de fake news tipo mbl e nando moura, vão estudar !"
1022608909884907520; ""sou mulher e apoio o bolsonaro" sou uma árvore e apoio o aquecimento global. #mulherescombolsonaro"
1020310498955464706; "@niihillab certeza que são negacionistas do aquecimento global que querem derreter as calotas polares"
1016849483102027776; "agrotóxico é o novo aquecimento global"
1015454491188105216; "gostei de um vídeo @youtube ção de co2 em sedimentos pode ser viável contra aquecimento global - space"
1021159472797048833; "@dozepontozero olha aí o canudo de plástico. contribuindo pro aquecimento global"
1015028956364464130; "sou a favor do aquecimento global pro nivel do mar subir e ter praia em minas gerais"
1022479128543547392; "águas nojentas, sismo e erupção vulcânica não têm a ver com o aquecimento global, tho"
1019223185651191808; "@dupioh "aquecimento global""
1020628371796037632; "@anapaulavolei a grande farsa do aquecimento global"
1018853481665441792; "gostei de um vídeo @youtube - aquecimento global e a neve no deserto do saara"
1015902581003051008; "@exame aquecimento global é o caralho, o corno que escreveu isso já ta em casa com a carne temperada............vá a merda"
1022186334885167104; "sim porque sismos, vulcões em erupção e incêndios têm tudo a ver com o trump e o aquecimento global"
1017082097297756160; "@madeleinelacsko geração aquecimento global, terra plana e pt partido honesto que defende pobre!"
1021847871702921221; "o aquecimento global é uma cena tão grave e tão à vista de toda a gente, nas ninguém quer saber, é triste..."
1015771578490064899; "@marcelofvs então marcelo... e se eu te disser que eu não acredito nessa falácia que é o aquecimento global ? e que a questao é muuuuito mais complexa do que você pensa ?"
1021557648213336064; "artigo: cadáveres desaparecidos durante décadas sob geleiras suíças emergem com aquecimento global - cadáveres desaparecidos durante décadas sob geleiras suíças emergem com aquecimento global"
1015710372341452802; "@omatheuslima_ diminuir a ingestão de carne, além de saudável diminui a emissão de metano, conhecido gás "estufa". se você acredita ou não no aquecimento global é outra história."
1018486721783136256; "cada vez fico com mais medo do aquecimento global!"
1024266218860109824; "suprema corte dos eua rejeita tentativa de donald trump de paralisar ação sobre mudança climática"
1023610280042029056; "@ptbrasil imagine se tivessem que plantar uma mudinha para cada real roubado pelo pt ... seria o fim do aquecimento global ... !"
1023960516224589825; "gostei de um vídeo @youtube luiz carlos molion: não existe aquecimento global"
1024033909447770112; "@airessousa83 @antonio_franco_ @one_josecarvalh @expresso @slbenfica @siconline @sicnoticias trumpistas? tenho consciência que o aquecimento global é uma realidade, já vós tendes a casa a arder e apontais a vossa preocupação para outros lados. realmente sois engraçados."
1014510052189921282; "aquecimento global"
1021823414330449921; "@pingozzy vai culpar o aquecimento global e a agropecuária também?"
1021179799023341569; "mas de qualquer maneira podemos mudar tudo isto, o problema é que existem pessoas ignorantes que acham que o aquecimento global é brincadeira"
1023329637995298816; "gostei de um vídeo @youtube verdade sobre o aquecimento global parte 2"
1017048170730319873; "cadê o aquecimento global que prometeram: via @youtube"
1020783663557070849; "@o_kleber @claudiasac1313 @carolcarvalho_ nada inesperado quando os fatos expõem o nosso despreparo. beijos de luz, anti-aquecimento-global ?"
1015943315852873728; "@macgyver_spy @rmn_sousa @gersongs @exame bem, até pouco tempo atrás, os veganos defendiam firmemente que as vaca eram as vilãs do aquecimento global. os flatos que os bichos soltavam, causavam problemas ao meio ambiente, segundo um "estudo especializado"."
1018164667934535680; "@kup7s com o aquecimento global, todo mundo que coloca um pão no chão faz uma torrada"
1021800661854429185; "vai galera, desmatem as florestas, façam queimadas, aumentem o efeito estufa mesmo. enquanto o ser humano não parar para pensar que grande parte desses desastres "naturais" são culpa nossa, a natureza ainda dará "respostas" como essa!"
1024111224265605120; "@joselitojunior1 é que o aquecimento global dilata o solo e aumenta a área do país"
1015298329893367814; "hoje tem baile da f aquecimento global gargalhada"
1017853471939276800; "mas o aquecimento global é uma "farsa" criada pelos chineses para prejudicar as indústrias americanas. ? iceberg gigante se aproxima da groenlândia e pode causar tsunami @uol"
1016107260970401793; "@luconrado1 aquecimento global"
1022859946856251398; "eu só quero que o @gordoi termine a tese dele e comece a escrever o cli-fi que se passa na patagônia do sec. xxiii (que se tornará a nova fronteira agrícola por conta do aquecimento global e casa dos 10% da humanidade que sobrou após o colapso no séc xxi)"
1020320891123707905; "aí ele chegou e falou que tinha descoberto uma forma de parar e reverter os efeitos do aquecimento global"
1022137487823699968; "@ramoncardosos @escbia bia, mandei um textinho pro ramon que fala isso, no futuro se outra civilização olhar pras galáxias fundidas talvez nem vá saber o que tinha antes, que nem a gente e aquecimento global é uma mistura de processo natural com influência humana. +"
1013908829518684160; "reclame aqui sobre o aquecimento global mentira faz pergunta, é tóis"
1022458719337164800; "@largamapila mas a dúvida não é do aquecimento global,eu não percebo as pessoas tbh a dúvida é se a culpa é humana ou natural, não é se há mudança climática, mas há quem consiga negar que o clima está sequer a mudar, eu não entendo"
1014280914489282562; "ta difícil, essa mudança climática o tempo todo ta me deixando mal demais"
1014825259978186752; "só vamos ter calor em outubro, jr andamos a brincar com o aquecimento global"
1020000094832095232; "vinho belga "beneficia" do aquecimento global https://t.co/jxto3db1sk"
1017350628996239360; "que desnecessário esse frio todo cade o aquecimento global que todo mundo fala"
1015704388885794817; "@roxmo ahh não! ! se deve a que?? alta do dólar? ? ou aquecimento global? ?"
1015599071577468928; "pronto, o churrasco de domingo do @jqtei com seus dias contados via @exame"
1015971326501314560; "@tiagocefas @paolacarosella agora entendi que "conservador" você é aqui interagindo na pauta "agrotóxicos" com a chef paola. conservadores não estão nem aí para essa pauta assim como não acreditam em aquecimento global. pecam neste aspecto. estranho sua presença aqui."
1020310441887748096; "segundo a lógica dos bolsonarinhos então o aquecimento global foi provado na “república de curitiba” sic neste mês! julho/1975 - neve e -6º c. julho/2018 - sol e 26º c."
1017775905882636289; "@bezerradavid16 @g1 o aquecimento global existe, o que não sabemos é se nós o criamos ou se ele sempre existiu, e o principal problema do aquecimento global sempre foi o resfriamento que geraria uma nova era do gelo"
1016725923335475201; "menos 9 graus em sc e voces ai acreditando em aquecimento global."
1024174137424654336; "@speemagrow então vamos falar sobre aquecimento global"
1023613889756450816; "@ggapki menos mal.. eu sofro com a mudança climática tbm. tipo amanhã já sei que vou acordar mal porque vai esfriar"
1021765636295479298; "aquecimento global é responsável por alterações climáticas.. deixa de ser ignorante e pesquisa"
1022926239563214850; "eu to 100% pistola com esse monte de névoa em po"
1018664113453568001; "é com muita alegria que eu venho informar que está noite dormirei de camisola. muito obrigada a todos pelo aquecimento global."
1018610346490200064; "puta que pariu quem é o loco de reclamar de aquecimento global velho graças a deus está 25 graus no inverno seis horas da tarde que benção"
1023976708549042177; "aquecimento global duplicou chance de onda de calor europeia https://t.co/gwxwcbf7kd rede de cientistas analisa extremos do mês de julho no continente e detecta impressão digital da ação humana. eventos do tipo poderão se repetir a cada cinco anos"
1021562995682541568; "@bbloka3001 @surveys4you @dinhastifler @_lorenareis_ @yannalouro sobre o aquecimento global"
1020452249028517888; "@conexaoplaneta empresários sempre negam tudo; o lucro vem primeiro. na visão/opinião não tem aquecimento global, as árvores da floresta serem cortadas para pasto ou plantio de outras culturas não causam seca no sudeste e por aí vai. a luta é grande"
1021448623593279488; "@alexaraujoc @claracamargol @guajajarasonia desculpe , mas há sim controvérsias acerca das causas , alguns cientistas acreditam que o aquecimento global possa ser um fenômeno natural . entretanto , a maior parte da comunidade acredita que seja fruto da ação humana , principalmente pós rev. industrial ."
1015440459710238720; "@hejacrvg nao sabemos acabei de mandar um zap pro sergiao pedindo o que vamos fazer agora sabia que o aquecimento global é culpa nossa?"
1019267073367728129; "duas coisas que gaúcho não acredita: no aquecimento global e no fim da água doce. razões: aqui tem duas estações: inverno e estação rodoviária. e só nesse mês já choveu aqui, os 3% da água doce da terra. e continua chovendo. fui um pouco exagerado, mas muito pouco."
1021918441576583168; "se o aquecimento global não existe como que você esplica esse valor na sua bunda"
1013265884062855168; "@cudeju assim como o aquecimento global, anjo"
1017452038534389760; "@ledpineapple não sabia que a culpa do aquecimento global é das armys não?"
1018356560530112512; "@fimdesemestre aquecimento global gera aquecimento no cu, hoje no globo repórter"
1015778238268956672; "gostei de um vídeo @youtube ção de co2 em sedimentos pode ser viável contra aquecimento global - space"
1021042458342379520; "aquecimento global? ask bts about it"
1020416139556466694; "faz 40 reais na sibéria e 30 graus em alguns lugares no círculo polar ártico esse mês mas aquecimento global é uma conspiração"
1017574669568929792; "@qrqtefds e se eu te disser que nada do que poderíamos fazer resultaria numa paragem/reversão do aquecimento global. e se eu te disser que o problema do planeta é gente a mais? como solucionas? cortas os huevos ou atiras-te da ponte?"
1022659765510594560; "@biasoli_ @_pinn @originalsant tava concordando ate tu falar de aquecimento global. teoria da conspiração em 2k18 man"
1023039525092818949; "@folha "aquecimento global é uma farsa!!!!!!!!!!!!!!!!!!11111111111111111onze"
1021377722860306434; "aquecimento global pfvr chega aí que eu quero ir pra praia."
1022619199913566208; "alguem disse que o aquecimento global é uma coisa boa? eu amo lady gaga, acho que ela é uma artista muito interessante"
1021658024270807040; "mas a direita continua dizendo que não existe aquecimento global."
1022181946926026753; "@edmorodrigues_ sim mano, mas o aquecimento global gira em todo de humanos estarem fazendo mal a natureza, nao que seja liberado fazer merda no mundo, mas em questao ao aquecimento global em si nao existe, oq a mida diz que o aquecimento global é, a ciencia desmente dizendo ser impossivel"
1019864228092661761; "@yoshio_carlos bom pra combater o "aquecimento global" que não existe ??? é mais uma agenda globalista."
1018264553266835457; "prof. luiz carlos molion: não existe aquecimento global via @youtube"
1016433647241621504; "a mudança no processo de produção de cimento é necessária para condizer com os planos de aquecimento global do planeta"
1019191506228244480; "com aquecimento global, falta de geladeira e ar condicionado vai afetar mais de 1 bilhão de pessoas: temperatura elevada vai elevar dificuldades de preservação de alimentos e de medicamentos naqueles que não possuem aparelhos de refrigeração, diz… https://t.co/bhyoylcfie"
1020735018052747265; "quando prepara p chover e eu tenho um role e mentalmente eu desejo que não chova eu penso quem sou eu p desejar a mudança climática em prol de meus interesses próprios se tem que chover pois que chova"
1023195812254425094; "passando pra dizer que aquecimento global não existe"
1019857947739000832; "passar o dia em casa no meu quarto- tranquilo, eles devem estar falando de aquecimento global dormir em casa- meu deus eles vão transar casar ter dois filhos e um cachorro"
1020425113190232064; "@pirulla25 @jordypsilon eu vejo uma analogia ao se discutir com criacionista e negador do aquecimento global. tente passar as suas afirmações tão categóricas como essas por um simples teste de sanidade. dá para falar muita coisa ruim do aécio, mas essa uber demonização não leva a lugar nenhum."
1018013072731066369; "@m8killtheplebs o aquecimento global existe, era isso que eu queria exprimir. agora quem o provocou é um tena completamente diferente. literalmente o que acabaste de fazer foi assumir coisas, subeentender coisas.só para conseguir arranjar barulho por amor de deus, leiam bem antes de falar."
1023714849875021824; "outro exemplo de velha louca descabelada magnífica: patti smith, aos 71 anos, ao vivo, fazendo cover de musica dos anos 80 e protestando horrores contra o aquecimento global lt;3"
1022457587940421634; "@kekistanqueen caralho ahahhaha não pode eu não consigo ter um discussão séria contigo. estás a dizer que tudo o que aprendi é mentira? se andasses em ciências e fizesses um teste escrevias lá “o aquecimento global é um mito”. mostra-me lá essas estatísticas da nasa e o site então sfv"
1014657374760652801; "vamos nos atentar para o aquecimento global, né mores salvem o urso polar, uhuuul"
1017432388840951809; "eu tinha muito medo do espaço sideral, não podia passar uma reportagens envolvendo planetas que eu apavorava. tinha medo do aquecimento global também kkkkkk"
1022159706465419266; "#cadáveres desaparecidos durante décadas sob geleiras suíças emergem com #aquecimento #global o derretimento das geleiras devido ao aquecimento global tem revelado corpos submersos durante anos no gelo desde 1926 https://t.co/e88f2gh1ok…/internac…/1532345833_454942.html"
1015740984318099461; "churrasco de domingo é vilão do aquecimento global impactos causados pela agropecuária chegam a 69% das emissões de gases de efeito estufa do brasil, incluindo poluentes do processo digestivo e dejetos de rebanhos, uso de fertilizantes e o desmatamento"
1021884644793503744; "não tem aquecimento global. é só no japão."
1024122008081190913; "aúnica maneira de provar que o aquecimento global é aumentado pelo homem é fazendo-o dimminuir. pois se o planeta pode causá-lo sem o homem , introduzi-lo na equação fere o princípio da navalha de ochan. preserve o #mundofeliz. pense."
