id;texto
1023641580358512640; "@patrickmaia febre é quando o corpo esquenta pra tentar matar aquilo que ta fazendo mal. sabe o aquecimento global? poisé."
1014116000122490880; "ok ent, pelas aulas de ciências e geografia de 9 ano percebemos que apesar do aquecimento global, em geral a terra está lentamente a arrefecer. a única coisa a corrigir aqui e o “lentamente”."
1020730652587700225; "achas... o aquecimento global não existe..."
1021391953328558081; "aquecimento global, co2. klmkoljkk"
1014314168000876544; "as algas são o pulmão do nosso planeta e o aquecimento global é real. informação útil: algas em estado de decomposição estão invadindo as praias do caribe. elas vem do oceano perto dos eua, e morrem por causa da temperatura da água. já faz um ano que o trump tirou a assinatura"
1017035165372174337; "saudades aquecimento global"
1018720854342094848; "não sei como minha cidade consegue um dia frio pra porra no outro calor dos infernos aquecimento global is here bitches"
1021756380678631424; "a maior parte da discussão em torno do voto impresso é porque a galera não entende o principio da independência do software. to falando, é uma questão técnica. ninguém do setor discute esse principio (que é super básico). isso é o equivalente a discutir aquecimento global gargalhada moderada"
1022269386982387719; "aquecimento global whom"
1020007088565706753; "eu nao gosto de frio mas quando faz calor fico preocupado pois lembro do aquecimento global"
1014695014428037120; "quando a água bater na bunda já vai ser tarde..."
1018660952194076674; "@andrflorencio1 @folha legal, mas ela é a favor do aborto, do casamento homoafetivo e apoia a pauta ambiental que combate o aquecimento global."
1016349716324470784; "@epocanegocios já falei e disse essa historinha de aquecimento global é para arrecadar grana!!!@#"
1015605458764161024; "@exame está foda.. antes diziam que o rebanho bovino é causador do efeito estufa porque vacas arrotam e flatulam(peidam).. daí eu pensei.. vamos matar as vacas e fazer o churrascão que resolve.. agora não dá mais pra fazer o churrasco? pqp..."
1022534575594057730; "à medida que as temperaturas globais sobem, grandes quantidades de carbono sequestrado em permafrost estão se tornando disponíveis #degelo #aquecimentoglobal #co2"
1016625647869923328; "@gauchazh sério que acreditaram que a brasil cumpriria a tal da meta contra o aquecimento global? desde o ano de 1500, o brasil jamais cumpriu uma única meta. ?"
1016373864258048001; "@jornaloglobo este papo de aquecimento global , é uma foma de ganhar mais dim dim. o planeta sempre aqueceu, e srmpre esfriou , se procurar la no inicio vão ver que isto não é novidade."
1014637830197440513; "vamos morrer assados ou conseguiremos deter o aquecimento global"
1013498629007474688; "@_queeneliz_ claro que o fato do ser humano estar na terra já causa tipo de impacto, mas o fato de não ser 100% eficiente (ainda) não justifica não fazer nada..certo? um hambúrguer 'plant-based', utiliza 95% menos terra, 74% menos água e emite 87% menos gases do efeito estufa que um de animal"
1013875036711768064; "riachos e rios podem bombear co2 para o ar a taxas crescentes se continuarem aquecendo, potencialmente aumentando os efeitos do #aquecimentoglobal"
1022266653214744576; "@marcogomes pelo oque eu li o aquecimento global já acontece há vários séculos, o maior causador disso seria grandes queimadas...então meio que é um ciclo, a terra esquenta depois ela se resfria."
1022392202633334784; "amanhã vão estar 36 graus meu 36 eu moro na bélgica isto é inverno o ano inteiro e aibda dizem que o aquecimento global é mentira"
1014472843399180289; "o aquecimento global é uma farsa e quem está o causando são as vacas"
1022238722186768384; "na minha nem essa aí do aquecimento global tem"
1021531415643607042; "@araujo_kimy o da terra plana é o mesmo do "aquecimento global é uma farsa"?"
1015951756440858625; "@johann01010 @pauloap pelo contrário! se você assistir aos vídeos, verá que eles apresentam toneladas de provas e derrubam qualquer argumento dos defensores do aquecimento global!"
1020116021125009408; "@elagabi tooo, mas vou bem no finalzinho do inverno amiga, hoje mesmo estava nevando muito na cordilheira, eu tb acho que demora pra derreter, maaas aquecimento global né"
1015529027329843200; "@natgeobrasil @arnokaplan mudança climática o caralho"
1014623534763724800; ""aquecimento global é uma mentira é falta de sacrifício""
1021810380572684288; "@cadupetkrevis @japa_efs @anasmartinss eu cansei de mandar artigo mas só mais um. comecei um debate super de boa com a ana e teve que entrar mais dois pra defender o ponto dela baseado em achismo, enquanto eu to mandando estudos de verdade. parabéns pela ignorância"
1018611917248753664; "yep, temos que colaborar com o aquecimento global."
1021773269890940929; "ao mesmo tempo que podem salvar vidas, ares-condicionados e outros aparelhos de refrigeração contribuem para o aquecimento global. qual a saída"
1020697483792592897; "agora que está esse calor em pleno inverno não aparece nenhum panguão pra contestar o aquecimento global."
1021639834073550848; "oque acha sobre o aquecimento global — cara, eu viajo nisso mas não sei oq falar não kkkkkkkkkkk"
1020693984086290434; "só tarda estás a falar de aquecimento global que é, como toda a gente sabe, fake news"
1017790233004343298; "@grasi_i7 exatamente, aí os tontos que são contra o aquecimento global, não entendem que alterar a temperatura do planeta em meio grau que seja muda toda essa dinâmica, vivemos num sistema complexo e dinâmico. pare de fertilizar a amazônia e vai ver o que acontece."
1024090550683631616; "mas não existe aquecimento global"
1017391233633804288; "essa semana o clima em são paulo entrou completamente no modo "o aquecimento global é uma farsa""
1022200608365928449; "@catarinaash00 isto significa que, ao nos preocuparmos tanto com o aquecimento global, a unica coisa que ganhamos é mais tempo para desenvolver tecnologias que iriam controlar os seus danos ( inevitáveis )"
1013896416773791744; "@bslvra lembra que a gente sempre fala em alteração climática? então..."
1022468493877432321; "forum brasileiro de mudanças climáticas vai pressionar presidenciáveis por ações contra efeito estufa"
1016244906099126273; "aquelas viral trends tipo faca quente a 1000 grau ou fidget spinner só mostram o quão fodido pra cabeça do homem está a ser este aquecimento global. e com esta me retiro... ! ??"
1024308875342827521; "@dw_brasil com aquecimento global e consequente mudanças climáticas, restará ao ser humano - assim como a todas demais espécies do planeta - o circuito: migração...adaptação...extinção"
1017374001876828160; "uma leve pesquisa e o aquecimento global cai por terra, falácia ???"
1019976183075803146; "a campanha #entrenoclima do imaflora apresenta informações sobre mudanças climáticas e emissões de gases de efeito estufa gee. os vídeos serão lançados todas as quartas-feiras nos canais digitais."
1022137099464654853; "pra namorar comigo tem que chegar até o jogo de gee e impedir o aquecimento global de uma festa vip aqui em curitiba para que esse acordo possa entrar em vigor e dar os respectivos resultados"
1023236877816655875; "neoliberalismo, monocultura, padronização, o aquecimento global já não é ficção"
1017479506121117696; "@andretrig depois do resgate dos jovens na caverna de tham luang na tailandia, nos ajudem agora a resgatar o planeta terra das cavernas da poluiçao, mudanças climaticas, aquecimento global, e destruiçao da floresta amazonica, precisamos de muitos herois"
1021939050607992835; "@ingridbstrbk fala assim nossa o aquecimento global ta uma loucura ne.... zoa fala que reassistiu game of thrones inteiro enwuanto a pessoa tavala"
1017927487580499982; "??doc | documentário - a grande farsa do aquecimento global. - nesse vídeo, apresento o documentário a grande farsa do aquecimento global. documentário que foi feito com a colaboração de grandes cientistas e ..."
1015356072704569345; "churrasco de domingo é vilão do aquecimento global via @exame"
1015297235305811981; "cientistas revelam culpado inesperado da catástrofe global: via @sputnik_brasil"
1020573848478142464; "e depois admiramo-nos com o aquecimento global e os seus efeitos... humanidade estúpida!"
1018680595625467904; "dicas para quem exalta a presidente da croácia, kolinda grabar-kitarovi?: - ela é favorável à legalização do aborto; - e também defende o acordo de paris, do qual os eua saíram sob o governo trump, afirmando que "a mudança climática é uma poderosa arma de destruição em massa"."
1015414046177353728; "pra quem não acredita em aquecimento global, este é o inverno mais quente dos últimos anos. pelo menos aqui no paraná."
1013826893513154560; "@hausofnatth devido a nossa transmissão ser via satélite, a mudança climática de temporais, chuvas e nuvens podem realmente causar intermitência e ausência de sinal por alguns instantes."
1016493456917651457; "socialista obstinado critica julio severo por não culpar o aquecimento global pelo furacão harvey"
1023045115202494464; "devemos cuidar do planeta, mas o aquecimento global é um terrorismo climático para você acreditar em leis inócuas como proibir canudinhos de plástico; é como combater a hipertensão proibindo sal nas mesas dos restaurantes. a temperatura média global vem caindo nos últimos anos."
1015259866846416897; "a mudança climática vista a pa"
1022135454961946630; "@poraodabbc rainhas da reciclagem fazem assim, no meu loonaverse não tem aquecimento global"
1020958753343115264; "e sabem de quem é a culpa é nossa, porque somos nós que provocamos a poluição, depois ficamos surpreendidos com a aquecimento global, portanto penso que está na hora agir, aliás já devíamos ter agido há algum tempo."
1020779625448976384; "pelo o que eu entendi o aquecimento global favoreceu o primeiro carnaval de inverno sem pneumonia em 80% da população criciumense é isso mesmo??"
1021250016625741829; "alguém me chama pra conversar sobre aquecimento global? grato"
1022584367544238080; "se você tivesse que façer uma precentação de 20 minutos sobre qualquer assunto, qual sería e por que — hmm, não sei, mas acho que eu iria por aquecimento global, pois acho que está a piorar e devemos..."
1017521388234641411; "gostei de um vídeo @youtube farsa do aquecimento global"
1022616659889192961; "em vez disso podemos todos começar a falar do aquecimento global ? é que eu ando a ficar mm assustada"
1022880481816150016; "@falgarof @dupioh @15memorias não existe mudança climática."
1019562714102976512; "o agronegócio, modelo baseado no monocultivo, no latifúndio e no uso de agrotóxicos, consome cerca de 70% dos recursos de terra e água do planeta, mas produz apenas 30% do alimento mundial. além disso, gera 40% das emissões de gases de efeito estufa."
1017765388044718080; "curso online introdutório sobre mudanças climáticas o curso oferecido pela un cc:e-learn apresenta "tudo o que você precisa saber" sobre os aspectos básicos da mudança climática, desde a ciência até a governança. o curso..."
1013738130573352960; "@batista1renato @kanazux @3ds0n_07 @ladyrebelrebel @atalaiabrazuca @jairbolsonaro para adotar uma ideologia é preciso ter fé cega. por exemplo: ideologia de gênero, marxismo, feminismo, aquecimento global."
1013615255820357632; "tem coisa mais bichona que ser alérgico a mudança climática?"
1017004353390022656; "nós temos ignorado uma ferramenta importante na luta contra o aquecimento global"
1022912657899356160; "como o aquecimento global atinge os recifes de corais | episódio 9 nív... via @youtube"
1024001759960805376; "@ocleitonbz @senadofederal não há aquecimento global, cleiton, o aquecimento é só regional. inventaram essa história pra onu arrecadar bilhões. o sol está passando pelo ciclo mínimo e a tendência é de um resfriamento global nos próximos anos."
1021534903979204610; "é o chamado aquecimento global..."
1022630696203022336; "londres mais quente que teresina! não, não existe aquecimento global!"
1014113632609697792; "as coisas estão a acontecer à nossa frente, só é mesmo cego quem não quer ver. acham este tempo normal nesta altura? mas, claro, o aquecimento global é um mito..."
1019591888247115776; "eu até acho uma piada do caraças estarem mais preocupados com que o ser humano desapareça por causa dos gays, do que preocupados em prevenir o aquecimento global que nos está a afetar neste momento e mais cedo ou mais tarde não é só a human race que vai com os porcos, é o planeta"
1017301845805543424; "wtf como assim eu em julho tenho de andar de casaco e mm assim tenho frio? fim de semana ok aquecimento global já percebemos que estás chateado connosco"
1016005877319524352; "muito quente aqui em la. está feliz aquecimento global?"
1019020166267535362; "vcs lembram da mensagem que a abertura dos jogos olímpicos 2016 aqui no brasil deixou pra gente sobre o aquecimento global ? estou aqui assistindo de novo essa abertura que está me fazendo parar pra pensar se as pessoas adotaram a mensagem. se estão realmente plantando árvores"
1013509890218831877; "pessoas burras não conseguem perceber que o facto de estar a chover nesta altura do ano é só uma consequência do aquecimento global"
1023386309388316674; "não existe aquecimento global. é só na califórnia."
1017368386664267776; "nessas horas que eu me pergunto cadê a poha do aquecimento global"
1015636189632745472; "@exame como assim, "aquecimento global"? comeram algo estragado? o que raios um churrasco tem a ver com ciclos solares conhecidos há tempos? o sol aumenta a atividade, a temperatura sobe, diminui, desce. agora, estamos, inclusive, num período de baixa. vide o gelo aumentando na antártid"
1022860411140550659; "cientistas dizem que onda de calor na europa é sinal do aquecimento global https://t.co/jhqjmqs5hx"
1021409367302856704; "@zeno_1972 assumamos que, de facto, não há certezas sobre as alterações climáticas/aquecimento global/whatever mesmo que 97% dos cientistas concordem com essa teoria. na falta de certezas, não seria preferível prevenir?"
1016540701520166912; "aquecimento global - namjoon kim"
1017514183783534595; "conferência discute o papel dos biocombustíveis no combate ao aquecimento global"
1021253122835066880; "canso de falar canso! isso também serve pra aquecimento global, que pasmem é um processo natural que a contribuição direta do homem é mt pequena"
1022497661218377728; "aquecimento global pode provocar 40 mil suicídios até 2050 estudo aponta ligação entre aumento de temperaturas e taxas de suicídio"
1017387607045570560; "@limpusdickus alguma vez ali disse que o ser humano é o factor principal do aquecimento global? easyyyyyyyyyy"
1021568769729159168; "aquecimento global causará onda de suicídios nos eua, dizem cientistas: via @sputnik_brasil"
1015358038721605632; "papa francisco alerta que o aquecimento global poderá transformar a terra em "uma pilha de entulho""
1014267951967559681; ""para alimentar o mundo e, ao mesmo tempo, salvar o planeta em tempos de aquecimento global, a onu encoraja, a partir de agora, a..."
1021551716309848070; "#empauta aquecimento global grande falácia, mais vocês tomaram partido a favor desta falácia."
1024412796757438464; "vcs acreditam no aquecimento global???"
1017216113195790336; "a croacia venceu por isso a ta tao frio eles planejam o nao aquecimento global malditos"
1022003232590233601; "isso apenas reforça a ideia da maldita farsa do tal do aquecimento global que está "derretendo as calotas polares e vai inundar os litorais do planeta"... kkkkkkkkkkkkkkkkkkkkkkkkkkkkk simples assim... aquecimento global é tão falso quanto a terra..."
1024429025861804032; "@luizcastrizana @astro_pontes @marinadolacre o cara apóia um criacionista que nem em aquecimento global deve acreditar e manda os outros pensarem ??? muita petulância"
1021029861916172288; "@tvbandnews que tristeza! e a tendência é só piorar com o aquecimento global."
1013857611945369601; "países pobres podem pagar us$168 bi em juros devido a mudança climática"
1022902995573456897; "os beneficios do aquecimento global..."
1020291476729794560; "@folha segundo alguns 'especialistas', não existe aquecimento global."
1018546961211744256; "@monica_igarcia eu entendo-te mas não vais ser tu, uma rapariga de 16 anos, a prevenir o aquecimento global e a fazer com que todas as pessoas comecem a deitar o lixo no caixote"
1021500663593938944; "e não há, chamam-se alterações climáticas, se fosse o tal de aquecimento global não estava a chover granizo em barcelona :"
1021929303481753600; "brasil tem alta de 8,9% nas emissões de gases do efeito estufa em 2016, diz ong"
1020771579838550016; "aquecimento global $uando frio"
1019272937176813568; "to amando esse inverno calorento mas ao mesmo tempo preocupado com aquecimento global"
1016368853738278913; "@igornascz a expectativa de longo prazo, com o aquecimento global, parece ser de aumento de chuvas nessa faixa (e queda catastrófica no alto são francisco e no mato grosso)..."
1015568870629871616; "@cabralpintoo @pensaporti @souogoncalo wtfffffff xd para começar a indústria animal é a maior contribuição para o aquecimento global, segundo, o gasto de água para fazer m hambúrguer de carne é o equivalente a passares 2 meses seguidos a tomar banho, agricultura mais poluente do que indústria animal ????"
1016384725638840323; "nariz vermelho e olhos lacrimejando, essa mudança climática acaba comigo ?"
1017072344534323200; "cadê a porra do aquecimento global?! eu tô trincando de frio... ??"
1018691637336248321; "chupa sociedade pavan! — eae meu bom aquecimento global nunca nem vi"
1016706628106633216; "desmatamento em alta pode minar chance de o brasil cumprir meta ... - sustentabilidade estadão"
1017358123768713216; "cadê o efeito estufa? eu quero o aquecimento global caralho! destruam logo a camada de ozonio, acabem com o frio na américa do sul k7"
1016394242883833856; "brasil corre risco de não cumprir meta contra aquecimento global"
1017103891559866368; "maldito aquecimento global"
1022226923580260358; "engraçado como agora culpam sempre o aquecimento global a tudo “ah tive 10 a biologia por causa do aquecimento global, confundia me nos testes” like wtf"
1015255684496183296; "aquecimento global ta bizarro. mó calor (papo de calor de verão) e estamos no inverno..."
1017879428486090752; "guaçuí não tem efeito estufa to com calor daqui pouco vou estar batendo queixo"
1024346821211107329; "gostei de um vídeo @youtube x ricardo - aquecimento global, efeito estufa"
1020634850959687680; "vinho belga "beneficia" do aquecimento global https://t.co/uvpk4f7w3j"
1021414016520945664; "@folha publiquei em @elizeusantos que o aquecimento global em nada se relaciona com a fragilidade da camada de oxônio (pois apenas um desastre natural poderia fazer isso). disse, aqui, que a alteração da órbita do planeta terra rumo ao sol seja responsável por isso. #usa #brasil @mit"
1017547674554380289; "aquecimento global pra mim é esquenta."
1021859290682937344; "thread especialíssimo para seu tio que não acredita em aquecimento global"
1013846745711857668; "@wuantt aquecimento global: - se vcs cuidarem do planeta eu prometo que vou embora"
1022215733168799744; "os havaianos, mc decão, menor do chapa, leandro e as abusadas, mc copinho, mc rael, aquecimento global... só vemm"
1017357801406988288; "8° em sp . por onde anda a farsa do aquecimento global ?"
1020990864779358208; "será que com a suécia em chamas ainda há pessoal que diz que o aquecimento global é hoax?"
1017773456300105728; "@g1 mas relaxem, segundo algumas pessoas o aquecimento global não existe porque está fazendo frio."
1015286785063170049; "tudo o calor do efeito estufa armazenado no nordeste ta foda"
1021425844395241473; "aquecimento global causará onda de suicídios nos eua, dizem cientistas https://t.co/gphlfzaacm"
1024362467617591296; "@dan_pego arrumaram e limparam o ralo lá da sala dani mas esqueceram de jogar um perfumin porque a nossa sala tava péssima um efeito estufa literalmente e advinha só quem senta bem em cima do ralo? eu mesma"
1019380022656806912; "apesar de eu ter acreditado, o aquecimento global (hoje com o nome de "mudanças climáticas") é uma farsa inventada por ditos "cientistas" de ideologia mais de extrema-esquerda. você pode ficar até chocado e me chamar de maluco, mas já se perguntou se isso é real?"
1013770072362450945; "adicionei um vídeo a uma playlist @youtube e a farsa do aquecimento global - tvch"
1021234904791646208; "dor de garganta ble, essa mudança climática ta louca, amo o frio, mas ficar indo de frio pra calor sempre fode muito minha saúde"
1022626178262282240; ""o problema do aquecimento global é que muita gente acredita em deus" diz ricardo almeida"
1024313246063505408; "@flu2011edson @nadanovonofront só que no caso a crise da vez coincidiu com as crises milenares da singularidade cibernética e do aquecimento global desenfreado."
1023269291557367813; "nunca vi uma estiagem tão longa assim, o mês de julho está quente e seco. será culpa do trump? ou é o aquecimento global, mesmo?"
1023286953855332352; "yoongi: garotas são quentes,garotos são quentes,porque todo mundo é tão quente?? namjoon: aquecimento global"
1022200110871134208; "@analaurarios17 documentário do abud sobre aquecimento global"
1020380736975761409; ""aí eu não acredito nisso de aquecimento global!" amiga do céu em qual universo que você vive??? ????? é nítido toda a pesquisa e consequências que estão ocorrendo ao longo dos anos decorrentes do ag!! pelo amor da mãe natureza, não fala besteira"
1019190253473730563; "com aquecimento global, falta de geladeira e ar condicionado vai afetar mais de 1 bilhão de pessoas"
1017775348631601152; "o que você acha de donald trump — vamo começar por ele não acreditar no aquecimento global"
1014314484184309761; "aquecimento global não é só pela parte do aquecimento em si..."
1015617013451026432; "é amigos, aquecimento global"
1020459200722370560; "@bonitopti omg, estava a ser irônica mesmo, o meu tweet é aquilo que o trump argumenta cada vez que se fala de aquecimento global, estão mais interessados em guerras e em deportar pessoas que não fazem mal a ninguém, separar crianças dos pais, etc"
1016859506842701824; "aquecimento global existe ou não?"
1024331769653473281; "?????? aquecimento global {?} me encontro num tipo de aquecimento global cardíaco; amor. e toda vez que eu sinto a tua falta, olho para o infinito céu estrelado do meu quarto, aquele mesmo que você implantou lá, onde eu passo horas idealizando um mundo onde a gente caiba."
1023533618453458945; "nox: o que são e quais os impactos dos óxidos de nitrogênio"
1024360100109144069; "entenda a relação entre o recorde temperatura na europa com o aquecimento global - #r7 via @portalr7"
1014669541140582402; "já era de se esperar que meu nariz teria esse tipo de atitude com a mudança climática"
1022208495947538432; "@donloficial @donloficial o que você pensa sobre a indústria agropecuária ser a maior responsável pela emissão de 69% de gases poluentes e 80% do desmatamento que contribuem com o aquecimento global? #respondedon"
1019439696533950464; "@tiefalicia oh yes efeito estufa"
1015041809716834304; "os primeiros animais do mundo também causaram o primeiro evento de aquecimento global – mas levou 100 milhões de anos https://t.co/dotpgmndbj"
1015610207903330304; "@exame já que el niño, la niña etc não foram os culpados do “aquecimento” global, embora culpar o churrasco. auspicia, los veganos!!!"
1020204190197583872; "a brasileira jbs, maior empresa de carnes do mundo, lidera a lista dos maiores produtores de co? do estudo, seguida por três corporações americanas: tyson foods, cargill e dairy farmers: https://t.co/rop3eqzvbq"
1022225924518039554; "@estadao dra @carolinamalta, isso pode ser mais uma confirmação do aquecimento global ou é só pra saber se vai dar praia?"
1015717040668147713; "aquecimento global? foda-se o planeta, eu vou estar morto em breve mesmo"
1016537699090685957; "oq acha do aquecimento global — isso aí é por causa do meu desodorante aerosol"
1022893405825843200; "agora os bozprasi vão acreditar no aquecimento global"
1023724078719545344; "ainda bem que já não tenho ciências da natureza para ouvir falar do "efeito estufa""
1023904842920742914; "agr aparecem os burros a dizer que aquecimento global só provoca aumento de temperatura kkkk"
1019406486521380864; "oi @netflix, tudo bom? pode me contar o que acontece em próxima parada: apocalipse, aquecimento global ou a coreia meteu pra fuder?"
1015361455892332544; "aquecimento global"
1022087157882802177; "chuva quase em agosto, viva ao aquecimento global"
1019912252336541696; "@capitaoplaneta @carlosbolsonaro quem ta falando merda é você. que não tem fundamento do que fala. no mínimo se baseando em estatísticas falsas e distorcidas. aliás todo idiota que entra nessa de salvar o planeta, aquecimento global, fim dos agrotóxicos, enfim abraçam a agenda imposta pela onu. tudoigual"
1022819128795639808; "grupo vai pressionar presidenciáveis por ações contra efeito estufa"
1021272923833806849; "cadê aqueles cornos que vêm questionar o aquecimento global no inverno nestas horas"
1023759098767204357; "aquecimento global é mentira"
1021003183303331841; "as cinco ameaças do clima para a saúde das crianças: até 2030, aquecimento global poderá provocar a morte, por desnutrição, de 95 mil meninos e meninas de até 5 anos https://t.co/23mhkqxeii"
